{
  "metadata": {
    "cote_archive": "AHC-2016003-0075_000",
    "type_fiche": 1,
    "photographie": false,
    "modele": null,
    "enrichissements": {
      "referentiel_materiaux": false,
      "referentiel_abreviations": false,
      "index_scripteurs": false,
      "few_shot": false
    },
    "tokens_entree": null,
    "tokens_sortie": null
  },
  "identification": {
    "numero_stock":     { "valeur": null, "confiance": null },
    "code_fabrication": { "valeur": null, "confiance": null }
  },
  "dates": {
    "date_entree_stock":  { "valeur_brute": null, "valeur_normalisee": null, "confiance": null },
    "dates_alternatives": []
  },
  "description": { "valeur": null, "confiance": null },
  "poids_brut_total": { "valeur_brute": null, "valeur_normalisee": null, "unite": null, "confiance": null },
  "materiaux": [],
  "vente": {
    "client":     { "valeur": null, "valeur_normalisee": null, "confiance": null },
    "date_vente": { "valeur_brute": null, "valeur_normalisee": null, "confiance": null }
  },
  "mentions": { "liste": [] }
}
